[
  {
    "id": "2026-10-22-petite-casbah-impressions",
    "title": "La petite Casbah",
    "href": "https://www.menti.com/al2uvcfq4wy5",
    "date": "2026-10-22",
    "note": "Para escribir las impresiones de la película, si fuiste a la sesión."
  },
  {
    "id": "2026-10-22-c06-cest-il-est-quiz",
    "title": "C'est / Il est",
    "href": "https://wordwall.net/resource/54255723?wwmethod=link",
    "date": "2026-10-22",
    "note": "Quiz."
  },
  {
    "id": "2026-10-22-c06-cest-il-est-classement",
    "title": "C'est/Il est",
    "href": "https://wordwall.net/resource/66175508?wwmethod=link",
    "date": "2026-10-22",
    "note": "Clasificación."
  },
  {
    "id": "2026-10-22-c06-cest-ce-sont-quiz",
    "title": "C'est / Ce sont / Il est / Elle est",
    "href": "https://wordwall.net/resource/91705123?wwmethod=link",
    "date": "2026-10-22",
    "note": "Quiz."
  },
  {
    "id": "2026-10-20-c05-les-presentations",
    "title": "Les présentations (ralenti)",
    "href": "https://seafile.biblivre.app/d/bb95955a0c7e4378a712/files/?p=%2F2026-10-20-c05-les-presentations.mp4",
    "date": "2026-10-20",
    "kind": "otro"
  },
  {
    "id": "2026-10-20-c05-villa-marie-claire",
    "title": "Les présentations dans la villa Marie-Claire",
    "href": "https://seafile.biblivre.app/d/bb95955a0c7e4378a712/files/?p=%2F2026-10-20-c05-villa-marie-claire.pdf",
    "date": "2026-10-20",
    "kind": "fotocopia"
  },
  {
    "id": "2026-10-20-c05-qui-est-ce",
    "title": "Qui est-ce ?",
    "href": "https://seafile.biblivre.app/d/bb95955a0c7e4378a712/files/?p=%2F2026-10-20-c05-qui-est-ce.png",
    "date": "2026-10-20",
    "kind": "fotocopia"
  },
  {
    "id": "2026-10-16-prononciation-present",
    "title": "Conjugaison au présent — prononciation",
    "href": "https://www.lepointdufle.net/ressources_fle/conjugaison_present.htm",
    "date": "2026-10-16",
    "note": "Para escuchar la pronunciación de los verbos en presente."
  },
  {
    "id": "2026-10-15-c04-production-ecrite-lettre",
    "title": "Une lettre à ta professeure de français",
    "href": "https://seafile.biblivre.app/d/bb95955a0c7e4378a712/files/?p=%2F2026-10-15-c04-production-ecrite-lettre.pdf",
    "date": "2026-10-15",
    "kind": "fotocopia"
  },
  {
    "id": "2026-10-15-c04-une-semaine-a-paris-corriges",
    "title": "Corrigés — Une semaine à Paris",
    "href": "https://seafile.biblivre.app/d/bb95955a0c7e4378a712/files/?p=%2F2026-10-15-c04-une-semaine-a-paris-corriges.docx",
    "date": "2026-10-15",
    "kind": "fotocopia"
  },
  {
    "id": "2026-10-15-c04-une-semaine-a-paris-texte-a-trou",
    "title": "Une semaine à Paris — texte à trous",
    "href": "https://seafile.biblivre.app/d/bb95955a0c7e4378a712/files/?p=%2F2026-10-15-c04-une-semaine-a-paris-texte-a-trou.pdf",
    "date": "2026-10-15",
    "kind": "fotocopia"
  },
  {
    "id": "2026-10-15-c04-passe-compose-revision",
    "title": "Révision du passé composé",
    "href": "https://seafile.biblivre.app/d/bb95955a0c7e4378a712/files/?p=%2F2026-10-15-c04-passe-compose-revision.pdf",
    "date": "2026-10-15",
    "kind": "fotocopia"
  },
  {
    "id": "2026-10-13-c03-une-semaine-a-paris-cartons",
    "title": "Une semaine à Paris — cartons",
    "href": "https://seafile.biblivre.app/d/bb95955a0c7e4378a712/files/?p=%2F2026-10-13-c03-une-semaine-a-paris-cartons.pdf",
    "date": "2026-10-13",
    "kind": "presentacion"
  },
  {
    "id": "2026-10-09-ressources-utiles",
    "title": "Ressources utiles",
    "href": "https://seafile.biblivre.app/d/bb95955a0c7e4378a712/files/?p=%2F2026-10-09-ressources-utiles.pdf",
    "date": "2026-10-09",
    "kind": "pdf",
    "note": "Para aprender francés en casa."
  },
  {
    "id": "2026-10-08-c02-nouveau-rond-point",
    "title": "Nouveau Rond-Point 1 — 15",
    "href": "https://seafile.biblivre.app/d/bb95955a0c7e4378a712/files/?p=%2F2026-10-08-c02-nouveau-rond-point.mp3",
    "date": "2026-10-08",
    "kind": "audio"
  },
  {
    "id": "2026-10-08-c02-le-voisin-philippe",
    "title": "Le voisin Philippe",
    "href": "https://seafile.biblivre.app/d/bb95955a0c7e4378a712/files/?p=%2F2026-10-08-c02-le-voisin-philippe.pdf",
    "date": "2026-10-08",
    "kind": "fotocopia"
  },
  {
    "id": "2026-10-08-c02-conjugaison-bilan",
    "title": "Conjugaison Présent indicatif — Bilan",
    "href": "https://seafile.biblivre.app/d/bb95955a0c7e4378a712/files/?p=%2F2026-10-08-c02-conjugaison-bilan.pdf",
    "date": "2026-10-08",
    "kind": "fotocopia"
  },
  {
    "id": "2026-10-08-c02-groupe-verbes-present",
    "title": "Le groupe des verbes au présent",
    "href": "https://seafile.biblivre.app/d/bb95955a0c7e4378a712/files/?p=%2F2026-10-08-c02-groupe-verbes-present.pdf",
    "date": "2026-10-08",
    "kind": "fotocopia"
  },
  {
    "id": "2026-10-08-c02-jouer-a-de",
    "title": "Jouer à, faire de, jouer de",
    "href": "https://seafile.biblivre.app/d/bb95955a0c7e4378a712/files/?p=%2F2026-10-08-c02-jouer-a-de.pdf",
    "date": "2026-10-08",
    "kind": "fotocopia"
  },
  {
    "id": "2026-10-06-c01-documento-inicio",
    "title": "Documento inicio de curso A2",
    "href": "https://seafile.biblivre.app/d/bb95955a0c7e4378a712/files/?p=%2F2026-10-06-c01-documento-inicio.pdf",
    "date": "2026-10-06",
    "kind": "fotocopia"
  },
  {
    "id": "2026-10-06-c01-informacion-alumnos",
    "title": "Información para los alumnos 2026-27",
    "href": "https://seafile.biblivre.app/d/bb95955a0c7e4378a712/files/?p=%2F2026-10-06-c01-informacion-alumnos.pdf",
    "date": "2026-10-06",
    "kind": "fotocopia"
  },
  {
    "id": "2026-10-06-c01-speed-dating",
    "title": "Fiches pour le speed-dating",
    "href": "https://seafile.biblivre.app/d/bb95955a0c7e4378a712/files/?p=%2F2026-10-06-c01-speed-dating.pdf",
    "date": "2026-10-06",
    "kind": "fotocopia"
  }
]
